[
  {
    "feedback_id": "vol8-feedback-001",
    "phase": "Vol.8 Phase 8.3 - Local Operator Feedback Review Model",
    "reviewer_role": "local_operator",
    "static_shell_path": "static_shell/ldd/",
    "feedback_title": "Static boundary banner needs stronger placement",
    "feedback_summary": "The reviewer may miss that the shell is local, static, read-only, fixture-only, no-network, and no-execution if the boundary notice is not repeated near the main review surface.",
    "category": "blocking_clarity_issue",
    "severity": "critical",
    "routing": "boundary_guardrail_review",
    "affected_artifacts": ["static_shell/ldd/index.html", "static_shell/ldd/SAFETY_BOUNDARY.md"],
    "boundary_risk": true,
    "customer_facing_claim": false,
    "network_or_api_claim": false,
    "execution_or_mutation_claim": false,
    "credential_or_auth_claim": false,
    "roadmap_only": false,
    "recommended_action": "Review static boundary wording and placement before any operator handoff.",
    "status": "accepted_static_feedback"
  },
  {
    "feedback_id": "vol8-feedback-002",
    "phase": "Vol.8 Phase 8.3 - Local Operator Feedback Review Model",
    "reviewer_role": "local_operator",
    "static_shell_path": "static_shell/ldd/",
    "feedback_title": "Panel hierarchy can be easier to scan",
    "feedback_summary": "The static panels could use clearer grouping between risk, opportunity, and boundary sections.",
    "category": "non_blocking_ux_improvement",
    "severity": "low",
    "routing": "static_shell_doc_refinement",
    "affected_artifacts": ["static_shell/ldd/README.md", "static_shell/ldd/OPERATOR_WALKTHROUGH.md"],
    "boundary_risk": false,
    "customer_facing_claim": false,
    "network_or_api_claim": false,
    "execution_or_mutation_claim": false,
    "credential_or_auth_claim": false,
    "roadmap_only": false,
    "recommended_action": "Document preferred panel scan order in the operator walkthrough.",
    "status": "accepted_static_feedback"
  },
  {
    "feedback_id": "vol8-feedback-003",
    "phase": "Vol.8 Phase 8.3 - Local Operator Feedback Review Model",
    "reviewer_role": "strategy_reviewer",
    "static_shell_path": "static_shell/ldd/",
    "feedback_title": "Fixture timestamp context is missing",
    "feedback_summary": "Fixture dates and review timestamps should say they are static evidence and not live market freshness indicators.",
    "category": "missing_context",
    "severity": "medium",
    "routing": "static_shell_fixture_refinement",
    "affected_artifacts": ["static_shell/ldd/static_shell_data.js", "static_shell/ldd/README.md"],
    "boundary_risk": false,
    "customer_facing_claim": false,
    "network_or_api_claim": false,
    "execution_or_mutation_claim": false,
    "credential_or_auth_claim": false,
    "roadmap_only": false,
    "recommended_action": "Add fixture timestamp notes to the static fixture documentation.",
    "status": "accepted_static_feedback"
  },
  {
    "feedback_id": "vol8-feedback-004",
    "phase": "Vol.8 Phase 8.3 - Local Operator Feedback Review Model",
    "reviewer_role": "product_owner",
    "static_shell_path": "static_shell/ldd/",
    "feedback_title": "Terminology differs between QA checklist and framework index",
    "feedback_summary": "The terms static shell QA handoff, local QA framework, and boundary freeze should be aligned across review docs.",
    "category": "terminology_drift",
    "severity": "medium",
    "routing": "implemented_framework_index_update",
    "affected_artifacts": ["docs/runtime/VOL8_STATIC_SHELL_QA_HANDOFF_CHECKLIST_v0.1.md", "docs/runtime/IMPLEMENTED_FUNCTION_FRAMEWORK_INDEX_v0.1.md"],
    "boundary_risk": false,
    "customer_facing_claim": false,
    "network_or_api_claim": false,
    "execution_or_mutation_claim": false,
    "credential_or_auth_claim": false,
    "roadmap_only": false,
    "recommended_action": "Use the Phase 8.3 feedback model as the terminology source for future QA notes.",
    "status": "accepted_static_feedback"
  },
  {
    "feedback_id": "vol8-feedback-005",
    "phase": "Vol.8 Phase 8.3 - Local Operator Feedback Review Model",
    "reviewer_role": "future_implementation_planner",
    "static_shell_path": "static_shell/ldd/",
    "feedback_title": "Roadmap candidate for saved feedback history",
    "feedback_summary": "A future planning phase could define a static feedback history view, but this phase should only record the idea as roadmap-only.",
    "category": "future_product_candidate",
    "severity": "note",
    "routing": "future_roadmap_backlog",
    "affected_artifacts": ["docs/runtime/VOL8_LOCAL_OPERATOR_FEEDBACK_REVIEW_GUIDE_v0.1.md"],
    "boundary_risk": false,
    "customer_facing_claim": false,
    "network_or_api_claim": false,
    "execution_or_mutation_claim": false,
    "credential_or_auth_claim": false,
    "roadmap_only": true,
    "recommended_action": "Carry forward as roadmap-only input for a later boundary mapping phase.",
    "status": "roadmap_only"
  },
  {
    "feedback_id": "vol8-feedback-006",
    "phase": "Vol.8 Phase 8.3 - Local Operator Feedback Review Model",
    "reviewer_role": "local_operator",
    "static_shell_path": "static_shell/ldd/",
    "feedback_title": "Request to connect live broker data must be rejected",
    "feedback_summary": "A reviewer request to connect live broker or market data is outside the static-shell boundary and must not be implemented in Vol.8 Phase 8.3.",
    "category": "forbidden_scope_request",
    "severity": "critical",
    "routing": "reject_forbidden_scope",
    "affected_artifacts": ["docs/runtime/VOL8_PHASE8_3_LOCAL_OPERATOR_FEEDBACK_REVIEW_MODEL_v0.1.md"],
    "boundary_risk": true,
    "customer_facing_claim": false,
    "network_or_api_claim": true,
    "execution_or_mutation_claim": false,
    "credential_or_auth_claim": false,
    "roadmap_only": false,
    "recommended_action": "Reject for current phase and restate no broker/API/live data boundary.",
    "status": "rejected_forbidden_scope"
  },
  {
    "feedback_id": "vol8-feedback-007",
    "phase": "Vol.8 Phase 8.3 - Local Operator Feedback Review Model",
    "reviewer_role": "strategy_reviewer",
    "static_shell_path": "static_shell/ldd/",
    "feedback_title": "Execution control request must wait for future gate",
    "feedback_summary": "A request to add action buttons for order placement or portfolio changes is execution-related and must be deferred until a future readiness gate.",
    "category": "execution_related_request",
    "severity": "critical",
    "routing": "defer_until_future_readiness_gate",
    "affected_artifacts": ["static_shell/ldd/SAFETY_BOUNDARY.md", "docs/runtime/VOL8_STATIC_SHELL_QA_HANDOFF_CHECKLIST_v0.1.md"],
    "boundary_risk": true,
    "customer_facing_claim": false,
    "network_or_api_claim": false,
    "execution_or_mutation_claim": true,
    "credential_or_auth_claim": false,
    "roadmap_only": true,
    "recommended_action": "Defer until a future readiness gate explicitly authorizes execution-boundary planning.",
    "status": "deferred_future_gate"
  }
]
